[
  {
    "id": "optiver-2027-software-chicago",
    "company": "Optiver",
    "title": "Graduate Software Engineer (2027 Start)",
    "category": "Software Engineering",
    "applicationUrl": "https://www.optiver.com/join-us/jobs/technology/chicago/graduate-software-engineer-2027-start/apply",
    "sourceUrl": "https://www.optiver.com/join-us/jobs/technology/chicago/graduate-software-engineer-2027-start/",
    "sourcePlatform": "Official company careers",
    "locations": [
      "Chicago, IL"
    ],
    "country": "United States",
    "workplaceType": "Unspecified",
    "compensation": "$200,000 USD base",
    "datePosted": null,
    "deadline": null,
    "startPeriod": "2027",
    "graduationWindow": "December 2026 through June 2027",
    "graduationMonths": [
      "2026-12",
      "2027-05",
      "2027-06"
    ],
    "experienceRequirements": "Graduate role; no professional experience minimum stated",
    "visaEvidence": {
      "level": "Strong",
      "explanation": "The exact posting states that Optiver supports U.S. immigration sponsorship for this role. Eligibility remains individual and must be confirmed against the current posting.",
      "url": "https://www.optiver.com/join-us/jobs/technology/chicago/graduate-software-engineer-2027-start/"
    },
    "firstSeen": "2026-07-31",
    "lastVerified": "2026-07-31",
    "status": "active",
    "closedDate": null,
    "tags": [
      "2027",
      "C++",
      "Python",
      "Java",
      "Trading systems"
    ],
    "missCount": 0,
    "sourceId": "manual-optiver",
    "degreeLevels": [
      "Undergraduate / Master's"
    ]
  },
  {
    "id": "optiver-2027-software-austin",
    "company": "Optiver",
    "title": "Graduate Software Engineer (2027 Start)",
    "category": "Software Engineering",
    "applicationUrl": "https://www.optiver.com/join-us/jobs/technology/austin/graduate-software-engineer-2027-start/apply",
    "sourceUrl": "https://www.optiver.com/join-us/jobs/technology/austin/graduate-software-engineer-2027-start/",
    "sourcePlatform": "Official company careers",
    "locations": [
      "Austin, TX"
    ],
    "country": "United States",
    "workplaceType": "Unspecified",
    "compensation": "$200,000 USD base",
    "datePosted": null,
    "deadline": null,
    "startPeriod": "2027",
    "graduationWindow": "December 2026 through June 2027",
    "graduationMonths": [
      "2026-12",
      "2027-05",
      "2027-06"
    ],
    "experienceRequirements": "Graduate role; no professional experience minimum stated",
    "visaEvidence": {
      "level": "Strong",
      "explanation": "The exact posting states that Optiver supports U.S. immigration sponsorship for this role. Eligibility remains individual and must be confirmed against the current posting.",
      "url": "https://www.optiver.com/join-us/jobs/technology/austin/graduate-software-engineer-2027-start/"
    },
    "firstSeen": "2026-07-31",
    "lastVerified": "2026-07-31",
    "status": "active",
    "closedDate": null,
    "tags": [
      "2027",
      "C++",
      "Python",
      "Java",
      "Trading systems"
    ],
    "missCount": 0,
    "sourceId": "manual-optiver",
    "degreeLevels": [
      "Undergraduate / Master's"
    ]
  },
  {
    "id": "optiver-2027-fpga-chicago",
    "company": "Optiver",
    "title": "Graduate FPGA Engineer (2027 Start - Chicago)",
    "category": "Systems / Infrastructure / Performance Engineering",
    "applicationUrl": "https://www.optiver.com/join-us/jobs/technology/chicago/graduate-fpga-engineer-2027-start-chicago/apply",
    "sourceUrl": "https://www.optiver.com/join-us/jobs/technology/chicago/graduate-fpga-engineer-2027-start-chicago/",
    "sourcePlatform": "Official company careers",
    "locations": [
      "Chicago, IL"
    ],
    "country": "United States",
    "workplaceType": "Unspecified",
    "compensation": "$200,000 USD base",
    "datePosted": null,
    "deadline": null,
    "startPeriod": "2027",
    "graduationWindow": "December 2026 through June 2027",
    "graduationMonths": [
      "2026-12",
      "2027-05",
      "2027-06"
    ],
    "experienceRequirements": "Graduate role; no professional experience minimum stated",
    "visaEvidence": {
      "level": "Strong",
      "explanation": "The exact posting states that Optiver supports U.S. immigration sponsorship for this role. Eligibility remains individual and must be confirmed against the current posting.",
      "url": "https://www.optiver.com/join-us/jobs/technology/chicago/graduate-fpga-engineer-2027-start-chicago/"
    },
    "firstSeen": "2026-07-31",
    "lastVerified": "2026-07-31",
    "status": "active",
    "closedDate": null,
    "tags": [
      "2027",
      "FPGA",
      "ASIC",
      "RTL",
      "Low latency"
    ],
    "missCount": 0,
    "sourceId": "manual-optiver",
    "degreeLevels": [
      "Undergraduate / Master's"
    ]
  },
  {
    "id": "optiver-2027-fpga-austin",
    "company": "Optiver",
    "title": "Graduate FPGA Engineer (2027 Start - Austin)",
    "category": "Systems / Infrastructure / Performance Engineering",
    "applicationUrl": "https://www.optiver.com/join-us/jobs/technology/austin/graduate-fpga-engineer-2027-start-austin/apply",
    "sourceUrl": "https://www.optiver.com/join-us/jobs/technology/austin/graduate-fpga-engineer-2027-start-austin/",
    "sourcePlatform": "Official company careers",
    "locations": [
      "Austin, TX"
    ],
    "country": "United States",
    "workplaceType": "Unspecified",
    "compensation": null,
    "datePosted": null,
    "deadline": null,
    "startPeriod": "2027",
    "graduationWindow": "December 2026 through June 2027",
    "graduationMonths": [
      "2026-12",
      "2027-05",
      "2027-06"
    ],
    "experienceRequirements": "Graduate role; no professional experience minimum stated",
    "visaEvidence": {
      "level": "Strong",
      "explanation": "The exact posting states that Optiver supports U.S. immigration sponsorship for this role. Eligibility remains individual and must be confirmed against the current posting.",
      "url": "https://www.optiver.com/join-us/jobs/technology/austin/graduate-fpga-engineer-2027-start-austin/"
    },
    "firstSeen": "2026-07-31",
    "lastVerified": "2026-07-31",
    "status": "active",
    "closedDate": null,
    "tags": [
      "2027",
      "FPGA",
      "ASIC",
      "RTL",
      "Low latency"
    ],
    "missCount": 0,
    "sourceId": "manual-optiver",
    "degreeLevels": [
      "Undergraduate / Master's"
    ]
  },
  {
    "id": "imc-4907368101",
    "company": "IMC Trading",
    "title": "Graduate Quantitative Researcher (BS/MS)",
    "category": "Quantitative Research",
    "applicationUrl": "https://www.imc.com/us/careers/jobs/4907368101/apply",
    "sourceUrl": "https://www.imc.com/us/careers/jobs/4907368101",
    "sourcePlatform": "Official company careers",
    "locations": [
      "Chicago, IL"
    ],
    "country": "United States",
    "workplaceType": "Unspecified",
    "compensation": "$250,000 USD base",
    "datePosted": null,
    "deadline": null,
    "startPeriod": "February or August 2027",
    "graduationWindow": "September 2026 through July 2027",
    "graduationMonths": [
      "2026-09",
      "2026-12",
      "2027-05",
      "2027-07"
    ],
    "experienceRequirements": "Graduate bachelor's or master's role; no professional experience minimum stated",
    "visaEvidence": {
      "level": "Historical",
      "explanation": "DOL-derived records show recent certified IMC Americas filings for comparable Graduate Quantitative Researcher roles. This employer history does not promise sponsorship for this opening.",
      "url": "https://www.ellis.com/visa-sponsors/imc-americas-inc/h1b"
    },
    "firstSeen": "2026-07-31",
    "lastVerified": "2026-07-31",
    "status": "active",
    "closedDate": null,
    "tags": [
      "2027",
      "BS/MS",
      "Python",
      "Quantitative modeling"
    ],
    "missCount": 0,
    "sourceId": "manual-imc",
    "degreeLevels": [
      "Undergraduate / Master's"
    ]
  },
  {
    "id": "imc-4751729101",
    "company": "IMC Trading",
    "title": "Graduate Quantitative Trader",
    "category": "Quantitative Trading",
    "applicationUrl": "https://www.imc.com/us/careers/jobs/4751729101/apply",
    "sourceUrl": "https://www.imc.com/us/careers/jobs/4751729101",
    "sourcePlatform": "Official company careers",
    "locations": [
      "Chicago, IL"
    ],
    "country": "United States",
    "workplaceType": "Unspecified",
    "compensation": "$250,000 USD base",
    "datePosted": null,
    "deadline": null,
    "startPeriod": "February or August 2027",
    "graduationWindow": "September 2026 through July 2027",
    "graduationMonths": [
      "2026-09",
      "2026-12",
      "2027-05",
      "2027-07"
    ],
    "experienceRequirements": "Graduate role; no professional experience minimum stated",
    "visaEvidence": {
      "level": "Historical",
      "explanation": "DOL-derived records show a recent certified IMC Americas filing for a comparable Graduate Quantitative Trader role. This employer history does not promise sponsorship for this opening.",
      "url": "https://www.ellis.com/visa-sponsors/imc-americas-inc/h1b"
    },
    "firstSeen": "2026-07-31",
    "lastVerified": "2026-07-31",
    "status": "active",
    "closedDate": null,
    "tags": [
      "2027",
      "Algorithms",
      "Financial markets",
      "Trading"
    ],
    "missCount": 0,
    "sourceId": "manual-imc",
    "degreeLevels": [
      "Undergraduate / Master's"
    ]
  },
  {
    "id": "imc-4818790101",
    "company": "IMC Trading",
    "title": "Graduate Software Engineer",
    "category": "Software Engineering",
    "applicationUrl": "https://www.imc.com/us/careers/jobs/4818790101/apply",
    "sourceUrl": "https://www.imc.com/us/careers/jobs/4818790101",
    "sourcePlatform": "Official company careers",
    "locations": [
      "Chicago, IL"
    ],
    "country": "United States",